post_id,title,author,url,num_likes,num_dislikes,num_comments,num_shares,created_utc,flair,post_text
85,SCS attendance requirements,fluvialweapon,https://www.reddit.com/r/NationalServiceSG/comments/1mfyskd/scs_attendance_requirements/,71,0,22,0,2025-08-02T19:17:53Z,Question,guys how much attendance is required to pass found term and pro term in scs respectively
86,Life of a supply officer?,Peter241018,https://www.reddit.com/r/NationalServiceSG/comments/1mfwmgy/life_of_a_supply_officer/,200,0,67,0,2025-08-02T17:46:10Z,Question,"Hi guys, I’m thinking of signing on as an officer in supply, but I’m not exactly sure what supply vocation is about as it’s so big. Would deeply appreciate if anyone can provide some insights!"
87,"Going back Gedong for medical review as NSMAN, can drive in?",Dull-Vanilla-2976,https://www.reddit.com/r/NationalServiceSG/comments/1mfvejk/going_back_gedong_for_medical_review_as_nsman_can/,64,0,19,0,2025-08-02T16:55:05Z,Question,
88,BMI drop and PES update for NS,VegetableReport4339,https://www.reddit.com/r/NationalServiceSG/comments/1mfu1v7/bmi_drop_and_pes_update_for_ns/,196,0,68,0,2025-08-02T15:58:36Z,Question,"hi all, im seeking some clarification. during my first medical screening about 4 months ago, my BMI was 31.8, and i was graded PES BP. i returned to CMPB ystd and was re-measured at a BMI of 26.7 with a PES D. had no known medical issues from my initial screening, and feeling much fitter now.

j wondering, how long does it usually take for the system to reflect any PES updates? and should i be prepared to be called back to CMPB again after such a change, or would it be updated automatically?

appreciate any insights from those who’ve been through something similar. thanks in advance!"
89,Any way to study/test during NS?,Shoddy_Twist_5599,https://www.reddit.com/r/NationalServiceSG/comments/1mfta0s/any_way_to_studytest_during_ns/,331,0,109,0,2025-08-02T15:26:16Z,Question,"Hey I'm gonna do NS soon but I'm still rather ignorant on how it all works. I graduated highschool with mid grades and a mid profile as a PR, but I really really want to make it into prestigious unis such as NTU and NUS. I'm currently like borderline (have chance but can't say how likely), so I want to continue building up my profile a bit to improve my chances, but I've heard that NS doesn't really offer a lot of freedom? I'm PES B1 and my Singaporean friend told me that it is almost certain that I will be joining an active combat position after my BMT, which will heavily restrict my freedom. I'm worried as if thats the case and I stay busy the whole time throughout NS, I might not be able to add things I want to my current profile...

Any advice on anything I could do or anything to expect please? Thank yall!"
90,How's Unit Life after BMT? -PES B2,mochishit,https://www.reddit.com/r/NationalServiceSG/comments/1mfslgy/hows_unit_life_after_bmt_pes_b2/,35,0,19,0,2025-08-02T14:58:30Z,Question,"I'm PES B2 currently in BMT. I feel shag but I'm just telling myself it will be better in unit and I'll have more freedom instead of only having &lt;48 hours of free time per week. Does it get better?

Also I'm a bit conscious about my appearance so I'm wondering if I can grow my hair back out to my near my eyebrows length after I'm posted to unit and does your skin untan after BMT? 

Thank you for reading my post. "
91,what was your best 2.4km timing and how long did it take for you to achieve it?,FrostyStranger123,https://www.reddit.com/r/NationalServiceSG/comments/1mfqugi/what_was_your_best_24km_timing_and_how_long_did/,50,0,28,0,2025-08-02T13:41:54Z,Question,"the faster your timing, the harder it is to see improvement 😦😦"
92,national day; is it a public holiday that saf can't interfere with?,Conscious-Group5820,https://www.reddit.com/r/NationalServiceSG/comments/1mfpqrv/national_day_is_it_a_public_holiday_that_saf_cant/,45,0,26,0,2025-08-02T12:48:54Z,Question,"bopian I got remedial training (in unit now)but I was told it was on this coming say, 9 august, meaning we couldn't book out on Friday and had to finish rt on Sat before booking out

is it allowed for rt to be placed on PUBLIC holidays? ain't sure and it don't feel fair too."
93,The Most Important Core Value,SupermarketHungry751,https://www.reddit.com/r/NationalServiceSG/comments/1mfnywv/the_most_important_core_value/,68,0,37,0,2025-08-02T11:12:39Z,📖 Story,"As the recruit enters PTMC, he had one goal in mind: to obtain an MC. MINDEF observes this, and asks the recruit, “Who would win? You or the MO?”

The recruit replies, “Well, if the MO sees through my keng, it might cause me a little trouble.”

“But would you lose?”

“Nah I’d win.”

Finally, the recruit arrives at the MO’s office, and the MO knew it was time to take action. He uses domain expansion, “1 day LD”, to try and stop him. However, the recruit confidently smiled and launches the accursed techniques, “chao keng” and “SAF 9th core value”, and nullified the sure-hit attack.

The MO was shocked and asks the recruit, “Are you a kengster because you practice the 9th core value, or do you practice the 9th core value because you are a kengster?”

The recruit simply laughed and replied, “stand proud, you’re strong, but you missed three key things. Firstly, when it comes to reporting sick, always bet on the recruits. Second, I am the one who will OOC with my overwhelming kengsterism. And third, with this treasure, I summon PES F.”"
94,How to get a heart checkup in NS?,NarwhalInitial6433,https://www.reddit.com/r/NationalServiceSG/comments/1mfl1zv/how_to_get_a_heart_checkup_in_ns/,55,0,30,0,2025-08-02T08:00:15Z,Question,"I had irregular heart pains since secondary school but have no idea why it suddenly just happened. I brushed it off as I thought it was just stress but it's been continuing up till now. 
CMPB health checkup said my ECG was irregular but when I went to National Heart Centre to do my tests and see doctor, doctor said ECG irregular was normal and I just needed to exercise more. 
It's been a few months since then and I have been exercising regularly these few months but the heart pains still happen. 
I am planning to get it checked in NS. How do I go about doing that? 

PS: I want to get it checked in NS cause I heard got medical subsidies. 
I have not entered NS yet. Going in in a few months. "
95,Transport Operator as a PES E,Friendly_Oil_1970,https://www.reddit.com/r/NationalServiceSG/comments/1mfkwdg/transport_operator_as_a_pes_e/,36,0,20,0,2025-08-02T07:50:01Z,Question,"Just got vocated as a TO, and will be doing vocational training at Sembawang camp. Reading the posts on here about TOs, it was mostly about driving the tonners and trucks and what not, so I was wondering how life is for a pes E recruit who'll only drive class 3.   
  
Another thing I was wondering about is unit life. How chill is it? Chances for stayout? And are there shifts like 4 days in 3 days out (one of my other TO friends said this but idk how common it is) ? Would really appreciate the input guys!"
96,License Conversion for TOs after ORD,bigbotbolro,https://www.reddit.com/r/NationalServiceSG/comments/1mfkn8k/license_conversion_for_tos_after_ord/,21,0,12,0,2025-08-02T07:34:01Z,Question,"01/23 Batch here recently ord after a 6 months STC, wanted to garner insight on the licensing process and how long it takes for the license to reflect on Singpass "
97,Is it true that there will be a confinement right before field camp?,Sad-Pattern-3073,https://www.reddit.com/r/NationalServiceSG/comments/1mfiiq4/is_it_true_that_there_will_be_a_confinement_right/,12,0,6,0,2025-08-02T05:23:23Z,Question,Hi i heard many people say there is confinement right before field camp is it true? There no instructions on it 
98,How to practice Servant Leadership in NS as a 3SG.,Working_Turnover_427,https://www.reddit.com/r/NationalServiceSG/comments/1mfh29i/how_to_practice_servant_leadership_in_ns_as_a_3sg/,32,0,18,0,2025-08-02T04:02:33Z,Question,"I am going to be a 3SG soon, and I want to make the most of my time in NS by growing as a leader. I often volunteer for appointments and make it a point to listen to and support my guys. That said, there have been times when a few individuals take advantage of that approach, which feels unfair to the rest who consistently pull their weight without causing issues.

I am trying to find the right balance between being approachable and supportive, while also maintaining the authority needed to meet the expectations set by my superiors. I would really appreciate any advice on how to manage that balance effectively."
99,Mental health appointment during confinement? Or should I get a diagnosis before I enlist?,GetsuI-DLE,https://www.reddit.com/r/NationalServiceSG/comments/1mffg6a/mental_health_appointment_during_confinement_or/,98,0,50,0,2025-08-02T02:38:56Z,Question,"I'll enlist in 2 weeks. I've been feeling troubled mentally so I decided to visit the nearest polyclinic. After a short consultation with the doctor, they said that my symptoms point towards a panic attack disorder. They gave me a referral to a psychiatrist to confirm the diagnosis but the earliest date they could book for me coincides with the day that I'll be in Tekong (confinement period, which is late this month).

Will I even be able to show up? I don't think I can change the date that easily because this kind of thing is scheduled months ahead. The doctor suggested that if I really want a diagnosis ASAP and declare before I enlist, I'll have to go private. I'm thinking of following that advice but I don't know if it's any better. AFAIK the only downside to it is that my enlist date will be pushed back right? I don't really mind.

I heard if people declare during confinement they'll have to be excused from showing up or sit out some activities, all that stuff. It sounds troublesome—makes me think I should just follow the doctor's advice so that I won't have to worry about any complications while I serve. Because if they delay my enlist date, everything will be sorted out by then right? Again, I don't know what's best so I'm really hoping to get some answers/opinions

TL;DR Facing mental health issues, not sure whether to get + declare my diagnosis after I enlist to avoid complicating things while in camp"
100,How David Neo's Son Case played out actually makes me Happy,JiPaiHongGanLiao,https://www.reddit.com/r/NationalServiceSG/comments/1mfcw9n/how_david_neos_son_case_played_out_actually_makes/,130,0,65,0,2025-08-02T00:30:47Z,Discussion,"[Previous context and history. -- Reddit Tread posted on July 14th '25](https://www.reddit.com/r/NationalServiceSG/comments/1lzjju4/what_happened_to_the_case_of_david_neos_son/)

Firstly, I want to be clear that I bear no hate, resentment or any feelings towards David Neo. This is not about him specifically, it is a reflection into the system.

**I am a farmer.**  I grew up believing that hard work will get you somewhere, And of course, you must play your cards right. Like many of you, I did not have a father who was somebody. \[In fact if you didn't know your father, that does make your father as a nobody\]. I believe in meritocracy. Unfortunately, with how small Singapore is, and how everyone is related to one another, it can be hard to hold this value. You do feel a big sense of nepotism looming in the country. Whether that is true or not, I cannot comment on that. I am a farmer. 

 [There is a comment ](https://www.reddit.com/r/NationalServiceSG/comments/1lzjju4/comment/n36tpzd/)in the tread that asks if the son made it to command school. That specific comment was answered with saying that the son did not make it into command school. Further replies speculated that the son did not pass IPPT as the definite reason. 

Whether was it because of the incident, or because of IPPT, I am happy. I am happy not because of the former chief of army's son did not make it to a command school, but because the system is working as it should be. 

A couple of years ago, Winston Choo, who was the first CDF, attended his grandson's officer commissioning ceremony.  [This was reported by mothership](https://www.youtube.com/watch?v=n02B1AYrV8w). There were a few comments that hinted at nepotism and it was ""given to him"". As quoted from one:

&gt;Everyone knew he'd be an officer way before he even entered NS. Imagine the chief of defence's grandson not being a decorated soldier. His commanders were all probably too scared of doing anything to him.

It is easy to draw lines. And maybe more so that CDF is higher ranking then CoA. But CoA isn't some small time position either. So I show happiness, not because of the underachievement of someone, but because it is testament to my belief. The belief of meritocracy.

On the sideline I also wonder: what kind of pressure do the descendants of these high flyers face to perform, being involuntarily linked to that legacy. 

Oh, and &gt;!because I said I am a farmer,  I[ do enjoy farming videos. ](https://vt.tiktok.com/ZSSUEmdGL/)As the saying goes:  老师有穿衣服，我差一点认不出老师了！！!&lt;"
70,Possible to go overseas during bmt?,Novel_Lawyer_9264,https://www.reddit.com/r/NationalServiceSG/comments/1mgxxox/possible_to_go_overseas_during_bmt/,49,0,16,0,2025-08-03T23:30:12Z,Question,I am currently oot in bmt. Was wondering if its possible to go overseas for a 2-3 day trip during bookouts. Will the saf know if i have left the country? Do i need to ask my encik for permission or apply for off-pass?
71,"help me please , i am rso restricted",Mediocre-Interest327,https://www.reddit.com/r/NationalServiceSG/comments/1mgxfwd/help_me_please_i_am_rso_restricted/,47,0,15,0,2025-08-03T23:07:55Z,Question,"rso banned , can i take mc from GP by booking MA ?"
72,ICT high key deferment need payback?,eulercauchy1,https://www.reddit.com/r/NationalServiceSG/comments/1mgkayz/ict_high_key_deferment_need_payback/,43,0,11,0,2025-08-03T14:13:54Z,Question,"Is it true that we need to clear 7 high keys to be considered MR and if defer 1 high key, need to payback that 1 high key after the unit I’m attached with has MR-ed?"
73,Does mono support coy mean a higher chance of SCS pro term combat support?,Mental-Current-6811,https://www.reddit.com/r/NationalServiceSG/comments/1mgk4np/does_mono_support_coy_mean_a_higher_chance_of_scs/,43,0,11,0,2025-08-03T14:06:36Z,Question,"My BMT was with mono 1SIR viper (support) coy and we were told we had a higher chance of going to a combat support vocation in 1SIR (CE, Arty, Recce, Signals) as a man. Does this also apply to SCS pro term?

I assume it would since we were told the reason we were mono support coy was because we had higher security clearance"
74,Question about Extending National Service,RottingRacoon,https://www.reddit.com/r/NationalServiceSG/comments/1mghxey/question_about_extending_national_service/,45,0,14,0,2025-08-03T12:23:33Z,Question,"If I extend NS for let's say 3 months, will I get increased pay? I'm a pnsf. I heard from my friend that his saf friend got 3k a month when he extended but I don't think there's any pay increase "
75,Signing on vocation choice,shaojixiongfan,https://www.reddit.com/r/NationalServiceSG/comments/1mggyfs/signing_on_vocation_choice/,110,0,34,0,2025-08-03T11:30:07Z,Question,"Hi, for context I'm a female still studying. I'm very close to submitting my app but I need some insights/help determining which vocation I really want. Since I'm looking at this as a long term job, I decided to sign as officer. Currently looking into being a Armour officer but I have my doubts if I will really enjoy it since I keep hearing both positive and negative things about Armour. (I'm aware it's not all sunshine and rainbows though) I'm ok with a bit shiong stuff, just not shiong like guards or infantry. I don't think I'll be very interested if I have to go outfield very frequently too. (Outfield to me is staying overnight in the jungle) Is armour the right choice or is there another vocation I should consider? Thanks."
76,Does this mean I am going to stay out?,Fast-Ingenuity-9242,https://www.reddit.com/r/NationalServiceSG/comments/1mgetk4/does_this_mean_i_am_going_to_stay_out/,51,0,14,0,2025-08-03T09:15:26Z,Question,"I just down pes-ed after i got the enlist date to e9 because of a physical condition + i got a temp excuse non air con environment . No mention of excuse stay in, but does it mean i will stay out?

"
77,SCDF PES B4 Experience for the next intake,Haunting_Ad_3109,https://www.reddit.com/r/NationalServiceSG/comments/1mge42i/scdf_pes_b4_experience_for_the_next_intake/,90,0,27,0,2025-08-03T08:27:32Z,📄 Guide,"So recently I just POP'ed from BRT and would like to share what it's like to be a PES B4 doing BRT. Gonna get my posting soon hopefully EMT if not Community Engagement HAHAHAHA.

Ngl it's pretty slack, BRT wasn't even a month for me it was like 3 and half weeks and you'll have quite abit of admin time. You won't do IPPT but you'll still do Foot drills and prepare for POP Parade and Rescue Training. As for punishment s you'll write lines that's about it. Some days will be chill and some days will be shag but you gotta remember to count yourself lucky that you're not in Tekong training.

Try to not isolate yourself and dread over the month ah cause trust me you won't enjoy BRT if you do that instead socialise and get to know your bunkmates, your platoonmates and your Sgts, Enciks and Sirs ah. BRT was fun for me and I made alot of memories with them.

Lastly, since BRT is only gonna be a month, try not to MC or RSO cause really it's only a month and the time passes really fast and you'll miss out ah. Also please please don't give your Sergeants, Enciks and Sirs any trouble cause they will kenna and not us, try not to make their lives difficult since your BRT gonna be slack."
78,How do I get excused stay in after being posted to unit?,OriginalPlastic5478,https://www.reddit.com/r/NationalServiceSG/comments/1mgd7am/how_do_i_get_excused_stay_in_after_being_posted/,117,0,36,0,2025-08-03T07:27:42Z,Question,Can anyone help me to give me suggestions/tips/recommendations?
79,after field camp. queries from gf,rivertiberwest,https://www.reddit.com/r/NationalServiceSG/comments/1mgcuft/after_field_camp_queries_from_gf/,217,0,70,0,2025-08-03T07:04:43Z,Discussion,"hi guys... sorry, i know u guys are SICK of gf posts but my bf is finishing his 5 day field camp this week and is confined all the way til next weekend. 

could u guys just briefly share if anything helped during the bookout the week of. or if there was anything u wanted, anything that helped. im planning to buy some linglinglonglongs for him.

he's been sending me gifts every single day during field camp and i just really wanted to return the sweet gesture.

any help appreciated, thanks!"
80,Preventing deferment of ICT?,lowrankbryan,https://www.reddit.com/r/NationalServiceSG/comments/1mgao1u/preventing_deferment_of_ict/,140,0,44,0,2025-08-03T04:51:38Z,Question,"It will be my first ICT since i got a job. Ive already defered once whilst schooling. This upcoming ICT im having is a High Key, and im trying not to defer it. However, I've  told my management about the ICT and they tols me to send them my call up, and they will send it to HR to get them to write to MINDEF to defer me (?).

I just have no idea how deferment works while employed tbh. Management says during the ICT period its a very busy period for us (which is true) but im just trying not to defer so i can have a break and catch up with my old friends lol. Also scared so that i will be doing ICT with random people incase i defer too many times (AI trooper incase it matters). "
81,Possible to RSI for injury obtained during weekend?,ContributionRare8226,https://www.reddit.com/r/NationalServiceSG/comments/1mgagg7/possible_to_rsi_for_injury_obtained_during_weekend/,189,0,59,0,2025-08-03T04:39:40Z,Question,"Hey guys..

So i fucked up my knee quite badly during my sunday league football game. I mean i still can walk but im struggling to climb stairs or sit on the floor. Cant bend my knee much as it feels like the tendon in my knee is super tight all of a sudden.

Firstly, Can i go still go and RSI for this, maybe get an xray or whatsoever? since it wasnt caused during my weekday in camp so idk if still can? Will the doc be okay with it or not allow since injury during bookout?

Sscondly, does any one know what is the issue with me knee? I already had a past injury but it got worse after landing wrongly single legged. Something related to meniscus? Acl? Mcl? I have no idea..."
82,Shortest time you seen someone hold a rank?,JiPaiHongGanLiao,https://www.reddit.com/r/NationalServiceSG/comments/1mg9i3x/shortest_time_you_seen_someone_hold_a_rank/,92,0,28,0,2025-08-03T03:47:06Z,Discussion,"I promoted PTE&gt;CPL 19 days before ORD, then my 19th day I only went in civi to another office collect IC so tech 18 days haha"
83,Questions about Pes B2 Bmt,FireFox279,https://www.reddit.com/r/NationalServiceSG/comments/1mg8swj/questions_about_pes_b2_bmt/,55,0,13,0,2025-08-03T03:09:29Z,Question,"1. Is it true that i just have to pass btp and outfield to graduate and that once i have passed these 2, will they still make me take ippt until i pass?

2. What is the outfield schedule like for pes b2? is the 4th day a full day or is it just a wake up and pack up type of day?

3. If i am excused heavy load, what happens during outfield?

4. How are vocations chosen for u? Is it completely random?

  
Thank you!!"
84,OCS CLM: What's the programme?,Own-Bag-6265,https://www.reddit.com/r/NationalServiceSG/comments/1mg88lo/ocs_clm_whats_the_programme/,47,0,11,0,2025-08-03T02:39:53Z,Question,As above. What do cadets go through during the first few weeks of OCS?
62,Service injury card reservist,NewUserG,https://www.reddit.com/r/NationalServiceSG/comments/1mhp516/service_injury_card_reservist/,54,0,18,0,2025-08-04T20:42:04Z,Question,"
Is it possible to apply for service injury card during reservist even though I failed to apply before I ord.

I have been suffering from Achilles tendon issues and knees issues for almost 2 years and yet, they couldn't find evidence for my injuries (saf physio, hospital, etc).

I'm already gonna ord soon, so I have given up hope on getting it at this point. My friends with long term injuries couldn't even get it too."
63,Has there ever been PES B2 firefighters,Photo-Timely,https://www.reddit.com/r/NationalServiceSG/comments/1mhlf7c/has_there_ever_been_pes_b2_firefighters/,22,0,7,0,2025-08-04T18:24:45Z,Question,How many are accepted each time and where do the rest go?
64,Polyclinic zero fees? How to,MrNotSmartEinstein,https://www.reddit.com/r/NationalServiceSG/comments/1mhcz6q/polyclinic_zero_fees_how_to/,92,0,35,0,2025-08-04T13:08:24Z,Question,I know we can waive the fees completely but don't know what to do to waive it. Last time I went the bill still showed up. Havent paid for 3 months lol. Anyone know?
65,SCDF PES B2 vocations FF or EMT,Photo-Timely,https://www.reddit.com/r/NationalServiceSG/comments/1mh8rsl/scdf_pes_b2_vocations_ff_or_emt/,87,0,31,0,2025-08-04T09:26:12Z,Question,"If gg into SCDF as a pes b2, which is more likely to get posted into, firefighter or EMT.

(For those that went into SCDF PES b2)"
66,Spf vocations for excused boots,Jolly_Background3004,https://www.reddit.com/r/NationalServiceSG/comments/1mh5knr/spf_vocations_for_excused_boots/,49,0,17,0,2025-08-04T05:59:55Z,Question,So I'll pop 10th Oct but I'm excused boots and sports shoes. Is staff assistant my only available choice? I stay in Northshore so traveling to hta everyday would be damn shag. Is hta the only sa place? 
67,Can I admit that I started a business in ns after I ord,Empty-Manager-3782,https://www.reddit.com/r/NationalServiceSG/comments/1mh3w1b/can_i_admit_that_i_started_a_business_in_ns_after/,71,0,25,0,2025-08-04T04:22:14Z,Question,And what evidence will officer try to get if caught doing business
68,Thinking of signing on SCDF (Firefighter) as a female,Early-Blacksmith-501,https://www.reddit.com/r/NationalServiceSG/comments/1mh2zpx/thinking_of_signing_on_scdf_firefighter_as_a/,142,0,49,0,2025-08-04T03:34:57Z,Question,"I'm 25F planning on a mid career switch because I'm so done with my industry. I used to be in NCDCC back then in sec sch so I kinda have a gist of what it's about and although ya the trainings are way different in so many ways. I have been thinking about it for quite awhile now. Anyways, tbh I don't think I will stay for like many many years so I thought, maybe just till the bond ends and for the experience huehue IDK BE HONEST W ME shld I??"
69,"Missed my IPPT, What Now?",godchurch3,https://www.reddit.com/r/NationalServiceSG/comments/1mh1n9z/missed_my_ippt_what_now/,40,0,14,0,2025-08-04T02:26:42Z,Question,"Hello everyone,

Long story short, I have missed any and all opportunity to pass into the enhanced batch of BMT and enjoy my 8 weeks of reduced service as I missed the two week cutoff point for P-E IPPT due to personal reasons.

I am physically fit, having obtained PES B1 and I currently lead a healthy and active lifestyle, which makes me feel like I’ve missed out on a big opportunity to reduce my service by a significant margin.

I understand that I will have to serve my PTP phase during BMT, but must I serve it in its entirety and do you guys have any tips regarding this process?

Thanks a lot for reading :)"
49,What are the items that became lifesavers during OCS?,Ill-Lynx662,https://www.reddit.com/r/NationalServiceSG/comments/1mid3gv/what_are_the_items_that_became_lifesavers_during/,39,0,14,0,2025-08-05T15:59:47Z,Question,This is to help out new officer cadets that just enlisted. Items could be stuff to bring from day 1 of OCS to items you never would've thought of but became lifesavers and made your life way easier.
