post_id,title,author,url,num_likes,num_dislikes,num_comments,num_shares,created_utc,flair,post_text
50,What are some severely underrated items to bring into SCS?,Ill-Lynx662,https://www.reddit.com/r/NationalServiceSG/comments/1mid2ud/what_are_some_severely_underrated_items_to_bring/,20,0,6,0,2025-08-05T15:59:03Z,Question,This is to help out new spec cadets that just enlisted. Items could be stuff to bring from day 1 of SCS to items you never would've thought of but became lifesavers and made your life way easier.
51,What are some severely underrated items to bring to BMT?,Ill-Lynx662,https://www.reddit.com/r/NationalServiceSG/comments/1micz8j/what_are_some_severely_underrated_items_to_bring/,28,0,9,0,2025-08-05T15:55:07Z,Question,This is to help out new recruits that just enlisted. Items could be stuff to bring from day 1 of BMT to items you never would've thought of but became lifesavers and made your life way easier.
52,Adjustment issues in NS (Mono Guards,Apprehensive_Bat1662,https://www.reddit.com/r/NationalServiceSG/comments/1mibw6i/adjustment_issues_in_ns_mono_guards/,140,0,55,0,2025-08-05T15:12:46Z,Question,"So i got posted to mono guards bmt about 1 month ago and since the first day i just cannot handle the shouting and timings we have to meet everytime where we have to rush everytime. It justs make me overwhelmed and frustrated as we are rushing just to wait 30min to a few hours sometimes for further instructions. 

Theres more details regarding my background but i dont wanna disclose here so pm me if you can help me thanks!

Basically i just have a few questions regarding how to get out of mono guards and get into a not so xiong vocation.

Questions:
1) Is guards one of the toughest vocation in saf that you can get posted too? If not what other vocation is tougher that everyone can get posted too?
2) Do everyone that is in mono guards bmt get sent back to unit? If not how many do get posted out and to where?
3) What methods are there to get out of mono guards?
4) What are the conditions you need to pass bmt so you do not need to rebmt?
5) What is recovery coy all about?
6) What the difference between temp downpes and perma downpes and how do they differentiate them?
7) Is private psychiatrist memo and pcc memo the same as i cant wait to see the pcc as it in about 5 weeks later"
53,Want medic vocation badly,Remarkable_Regular15,https://www.reddit.com/r/NationalServiceSG/comments/1mi7wuh/want_medic_vocation_badly/,38,0,13,0,2025-08-05T12:32:29Z,Question,"Currently B1 in BMT, POP-ing early next month. I really want the medic vocation. Already indicated interest through the vocation interest form, and also told my OC, but he said he and the CO can’t help, must email CMPB.

Emailed CMPB, but they just told me to approach my unit commander… so I’m kinda stuck now.

I have a diploma in pharmaceutical science and declared 3 hospital work stints in my G50 form, total around 1 year in hospital pharmacies. My section commander said got high chance I’ll get medic. True or not?"
54,What are the most underrated vocation perks no one talks about?,BolehBolehBro,https://www.reddit.com/r/NationalServiceSG/comments/1mi7ewc/what_are_the_most_underrated_vocation_perks_no/,52,0,17,0,2025-08-05T12:09:05Z,Discussion,"Everyone loves to roast certain vocations or glorify others, but I think we don’t talk enough about the unexpected perks some NSFs get depending on where they’re posted.
For example:

- Some logistics units have access to really chill workspaces with aircon and regular 9–5 hours.
- Certain SAFPU or SPF units offer early exposure to real-world enforcement work (looks decent on a resume).
- Cybersecurity vocations now actually give you access to real training certifications like CompTIA.

What other “hidden gems” have you guys come across? Not just about slacking - but actual useful or meaningful experiences you didn’t expect when you first got your posting.
Would be nice to hear from different batches and vocations."
55,Mid career switch to DIS MDES (C4X/MIE),bingdablings,https://www.reddit.com/r/NationalServiceSG/comments/1mi56lk/mid_career_switch_to_dis_mdes_c4xmie/,77,0,26,0,2025-08-05T10:08:27Z,Question,"Hi, 28 M currently working corporate job in a completely different industry. I applied to DIS and indicated strong interest in C4X. Reason was because my current job is mundane but pay is relatively ok - 4+on my 3rd year. Thus me exploring my options and finding jobs that seem more meaningful and stimulating. I am also on my final year in local Uni taking part time degree in Business.

I was keen to explore more on cyber defence and security thus applying for the role. I have my MAPAS test and interview scheduled next week. However, upon speaking with the recruiter, he mentioned that I should apply for MIE instead due to my lack of experience.

I looked at the role and realised that the trainee and actual pay was very low, and progression doesnt seem that good especially going in as ME1. Should I still attempt to go for the interview for C4X or should I just cancel the interview to not waste my time and their time? I am aware of the pros and cons of signing on and I am ok with them apart from the low pay."
56,LPT: USE SAF insect repellant for bed bugs,FauxPseudoFacts,https://www.reddit.com/r/NationalServiceSG/comments/1mi51mi/lpt_use_saf_insect_repellant_for_bed_bugs/,47,0,17,0,2025-08-05T10:00:32Z,Discussion,if u go bunk has bedbugs inside the bed u spray the insect repellant on to it and all the bed bugs will leave the bed and then u just have to squish them to death and you won’t be bitten 
57,How do I go about with trying to downpes,EstablishmentHairy37,https://www.reddit.com/r/NationalServiceSG/comments/1mi4vs6/how_do_i_go_about_with_trying_to_downpes/,183,0,69,0,2025-08-05T09:50:29Z,Question,"

Context: I'm currently pes b1 doing bmt, I have diagnosed gout and am xurrently on medication for it however sometimes due to circumstances, be it a tight schedule or some other issues I do not take the medication resulting in a gout flare which pretty much cripples me for a few days till I can walk properly again, secondly I also have a kidney issues where one side is slightly smaller than the other causing it to overwork and leak protein into my urine which would result in that kidney ""dying"" quicker than an average one, therefore I started telmisartan for that issue, however that medication has started causing me headaches and lightheadedness that I did not feel before taking that medication. Lastly I had an old Achilles injury from basketball on my right leg that I did not declare before entering as I wanted to try and go throught the whole bmt experience, however after doing outfield, my Achilles injury started acting up quite a bit after being in boots for so long which made me limp from place to place. Can I get some advice as on what to do and if I even have a chance to down pes? As I've gone for medical review and the doctors seem ABIT hesitant as to whether or not I can. As much as Ive been enjoying my experience in bmt so far I'm not to sure how far my body can go until it breaks down, to add on I'm part of mono guards which means I'll be doing gvt or GCC depending on my posting and truthfully I'm not planning to sign on so I do not want to risk my health just for two years of ns. Please help thank you 🙂"
58,"Wear no4 to Johore, declaring war?",FauxPseudoFacts,https://www.reddit.com/r/NationalServiceSG/comments/1mi4k3o/wear_no4_to_johore_declaring_war/,64,0,22,0,2025-08-05T09:30:02Z,Question,"Assume you are a Malaysian PR. Then you need to serve ns in Singapore but your family house is in Johore. Then you book out and you go home.

Or assume you are a Singaporean then you going Johore right after booking out.

Or assume you are a Malaysian student in sg and you join ncc.

Then if you cross the border in no4, is that a declaration of war?"
59,Can PES E sign on during NS?,No_Age_9041,https://www.reddit.com/r/NationalServiceSG/comments/1mi3ep9/can_pes_e_sign_on_during_ns/,89,0,32,0,2025-08-05T08:15:34Z,Question,"Posting on behalf of a friend who’s PES E and about to enlist.

He’s wondering:
	1.	Can PES E servicemen express interest or sign on during BMT?
	2.	If they sign on, does it count toward the 2-year NS obligation?
	3.	Has anyone actually done this while PES E? What was the process like?

4. what roles are available for pes E to sign on? eg. DIS,admin,logistics 


He just wants to understand what’s realistically possible despite being PES E. Any insights or experiences would be appreciated "
60,Going from sub 10 to sub 9 2.4 in 2 months?,Big-Guarantee-5509,https://www.reddit.com/r/NationalServiceSG/comments/1mhys4q/going_from_sub_10_to_sub_9_24_in_2_months/,36,0,12,0,2025-08-05T03:41:36Z,Discussion,"Hi guys I recently made a bet with someone to go from a sub-10 to a sub-9 2.4 by October

For those who run sub 9, how long did the improvement take and what were your other PBs as you neared sub 9? (Eg 5K, 10K)

And how important is dropping weight? I’ve gained almost 8kg since BMT, but most of it is upper body muscle. It kinda sucks but I’m considering dropping weight"
61,Anyone is currently in Transport operator while excuse Stay in,Carzdude556,https://www.reddit.com/r/NationalServiceSG/comments/1mhxhvv/anyone_is_currently_in_transport_operator_while/,21,0,7,0,2025-08-05T02:39:10Z,Question,"Planning to up pes (Up pes to Pes E1) to Reapply as transport operator but is unsure of doing so as I have excuse stay in.

I heard that E1 Transport operator does not need stay in?
"
40,Post exit-permit commando reservist,Bart_Simpson1516,https://www.reddit.com/r/NationalServiceSG/comments/1mjdr4h/post_exitpermit_commando_reservist/,61,0,26,0,2025-08-06T19:12:50Z,Question,"I ORDed from 1cdobn few years ago and got assigned my NS cdo battalion, but took exit-permit to study overseas.

What happens when I return back, will I join my original NS battalion?

Do I still need to begin and complete the 6-8 reservist cycles  or is there an age cutoff?

Is there a chance that MINDEF forgets me completely upon return?

Thank you"
41,Can I get referral to pluck wisdom tooth outside as SAF dental doesn't perform general anesthesia?,PrawnNoodleSG,https://www.reddit.com/r/NationalServiceSG/comments/1mizgmh/can_i_get_referral_to_pluck_wisdom_tooth_outside/,83,0,37,0,2025-08-06T08:52:15Z,Question,"As the title goes, curious if anyone done it before?"
42,Dont want to down pes during BMT,idkpeoplehere,https://www.reddit.com/r/NationalServiceSG/comments/1miygrm/dont_want_to_down_pes_during_bmt/,242,0,110,0,2025-08-06T07:46:04Z,Question,"I am Pes BP batch 04/25 and currently still in confinement and had went through two MR and was told that my Haemoglobin level is low, and would have to down pes to c9. I searched online regarding the various symptoms of having low haemoglobin level and i do not experience any of it.

Previously when I did my body check up at CMPB, the result came short by 0.2 from the acceptable haemoglobin range, and at PTMC, the new result drop quite a bit but as mentioned, I do not feel any of the symptoms.

The other contributing factor that correlates to low haemoglobin could be low iron count. My general diet doesn’t include much of red meat or high iron diet.

The MO told me to go to a Polyclinic to get some iron supplements and would have to down pes me due to my low blood count.

Honestly, I want to complete my BMT in tekong and not get down pes.

Hope that somebody have some idea on how to discuss this with MO."
43,What Happens if Someone Hides a Vape in Your Belongings During an Inspection?,Substantial_Egg443,https://www.reddit.com/r/NationalServiceSG/comments/1miuk9j/what_happens_if_someone_hides_a_vape_in_your/,218,0,99,0,2025-08-06T03:55:13Z,Question,"what happens if someone place vape in Ur belonging to prevent getting caught during inspection and u get caught for it?

Edit: Just asking cuz a friend said their bunk got searched for it, (The someone hide in ur belongings is just a hypothetical qn, sorry for not indicating so)."
44,Anyone received letter for October BP batch ?,Substantial_Egg443,https://www.reddit.com/r/NationalServiceSG/comments/1miuj8w/anyone_received_letter_for_october_bp_batch/,21,0,8,0,2025-08-06T03:53:44Z,Question,"""Has anyone received a letter confirming their selection for the October BP batch to attend or join?"""
45,"Struggling in EMT course, is it possible to transfer to FF? Would really appreciate advice",Darthvader957,https://www.reddit.com/r/NationalServiceSG/comments/1mis5y6/struggling_in_emt_course_is_it_possible_to/,167,0,70,0,2025-08-06T01:57:03Z,Question,"Hey guys,

I’m currently in EMT in SCDF training and I’ve been feeling really overwhelmed. It’s only been a couple of days but I’m already starting to feel like it’s not the right fit for me mentally and physically.

I’ve been thinking about whether it’s possible to request a transfer to Firefighter instead — I know it’s not necessarily “easier”, but I think I might be able to cope better with that role.

I’m not trying to slack or escape NS. I just want to be able to serve properly in a role that I won’t mentally burn out from over the next 2 years.

Has anyone here successfully transferred vocations after BRT or early into EMT course? Who should I speak to, and what should I expect? Any advice would really help.

Thanks in advance 🙏
"
46,Transport Operator (CSS) OOC?,[deleted],https://www.reddit.com/r/NationalServiceSG/comments/1mirasv/transport_operator_css_ooc/,28,0,11,0,2025-08-06T01:16:25Z,Question,"should i OOC from TO? still waiting for driver course to start and dont really want to become a driver…

what should i do? should i ask encik to post be out to be ASA/SA?

please advise me… dreading driving 😰😰"
47,How do I chiong for last IPPT in a couple weeks?,vrooooooooommm,https://www.reddit.com/r/NationalServiceSG/comments/1miqz8r/how_do_i_chiong_for_last_ippt_in_a_couple_weeks/,68,0,33,0,2025-08-06T01:01:32Z,Question,"Just completed my 2nd last IPPT, and while I improved from my prev attempts (3→28→39 pushups, 10→35→38 situps), my run time is still terrible (18:30). I've about 4 weeks to POP, so 2-3 weeks to last IPPT attempt? and I wanna minimally pass. In hindsight, kinda stupid of me to take the whole BP BMT focusing on my statics rather than my running but I can't change that now.

My running sucks, mainly because about 600m in my legs start to feel really heavy.

What's the best way to structure and min-max my training/SRT to be able to minimally pass by my last IPPT, especially my running?"
48,DO PES C2/9 ASA NEED TO COME BACK FOR RESERVIST?,ContributionRare8226,https://www.reddit.com/r/NationalServiceSG/comments/1miqxnx/do_pes_c29_asa_need_to_come_back_for_reservist/,39,0,17,0,2025-08-06T00:59:36Z,Question,"Hi guys,

Wanted to ask if im pes c2/9, and in ASA rn, will i have to come back for reservist? And if i do, is it a  normal 9-5pm job for a week? I dont see why asa shud come back as reservist 🤣 

ASA personnels, please enlighten me more about ASA. Im doing voc training rn and im hoping i get posted to a stay out unit. And i know asa 95% will get stay out but idw to be the unlucky one. Also currently on 3 months temp exc stay in, will that affect my chances of getting a stay out unit?"
30,"Weekly questions and discussions - August 07, 2025",AutoModerator,https://www.reddit.com/r/NationalServiceSG/comments/1mkbxfs/weekly_questions_and_discussions_august_07_2025/,12,0,8,0,2025-08-07T21:00:38Z,Weekly,"Use this to ask smaller questions or for discussions.

* Downvotes are strongly discouraged
* Please be polite
* Join our [Discord Server](https://discord.gg/jRSWjdtQg7)
* Read the [Frequently Asked Questions](https://national-service.now.sh/faq) too

If you have any issues, please [contact the mods](https://www.reddit.com/message/compose?to=%2Fr%2FNationalServiceSG)."
31,Update on pes f: My encik asked me not to downpes to F,Material-Night-2552,https://www.reddit.com/r/NationalServiceSG/comments/1mk6fxr/update_on_pes_f_my_encik_asked_me_not_to_downpes/,318,0,157,0,2025-08-07T17:32:05Z,Question,"My encik saw my post on whether to downpes to F or continue serving as a uniformed personnel and said if I downpes to F,I will be affecting multiple people in my current unit due to lack of manpower.He asked me to go back serve in office to not make others lives not as hard as possible. Am I able to just ignore and block him from now on as I am gonna answer to PCC that I will be taking the pes F from next week or is this still considered disobedience of general orders,I am so tired of NS honestly."
32,"IN CAMP RATION, a travesty? (My take)",majulahsotongs,https://www.reddit.com/r/NationalServiceSG/comments/1mk6bsg/in_camp_ration_a_travesty_my_take/,154,0,73,0,2025-08-07T17:27:45Z,Discussion,"
MY TAKE so if you feel offended or a need to say “back in my day” please, book yourself out. ➡️🚪

I was never a picky eater, i find below average food tasty. But wow, they warned me but i was NOT prepared, i have never had food as remotely bad as in camp food.

Shit so bad i find myself missing my downstairs kopitiam food ✋😔

I was scoffing down out-ration dinner with my ma’am a couple days back and jokingly told her “If i could feedback 20 things wrong with the food i will”

she laughed, but i was serious 

1. Breakfast: oily, deep fried, processed 
2. Breakfast: Low in protein 
3. Breakfast: Carb overload 
4. Breakfast: Bread so dry its a safety hazard
5a) Breakfast: Protein is always processed food
5b) Breakfast: The sausage they give me always looks like an old mans wrinkled cock bro 😭

6) Breakfast: Hurt my teeth biting into the oily croissant thats still somehow STIFF

7) Breakfast: Fried noodles with NEGATIVE flavour, literally felt the taste sucked from my tongue, thought i had covid again

8)Dinner: Rice grains that looks like they collected the leftover from hawker centre and recycled it for SAF

9)Dinner: Constant microwaved dinner with gravy so heavy with salt my tongue is getting buff lifting all that WEIGHT

10)Dinner: Vegetables so stiffly overcooked my tongue kena stabbed 😔 

11)Dinner: Rice that just FEELs wrong, as an Asian with decades of rice eating, the rice lacks the essence that makes it RICE. 

11b) If Skinwalker tries to impersonate rice, it would be outration rice


Ok thats all, NSF wear helmet too stupid to count to 20."
33,Am I allowed to bring my OCS commissioning sword out of SG to overseas?,cykaharaqu,https://www.reddit.com/r/NationalServiceSG/comments/1mk04ia/am_i_allowed_to_bring_my_ocs_commissioning_sword/,40,0,19,0,2025-08-07T13:28:53Z,Question,"As the family is moving, I would like to bring it along with me overseas. Is it possible?

Are there any restrictions regarding this, or do I need a special license to bring ""weapons"" out of Singapore?

If so, how do I proceed?"
34,Life as OPS at Fire stations,Brilliant_Jacket_466,https://www.reddit.com/r/NationalServiceSG/comments/1mjxme5/life_as_ops_at_fire_stations/,47,0,17,0,2025-08-07T11:33:56Z,Question,Wish to know from anyone who experienced this to describe how things go when working 12hrs shift at any fire stations as watchroom operators 🙏🏻
35,"Offered exemption,pes f from army,should I take it?",Material-Night-2552,https://www.reddit.com/r/NationalServiceSG/comments/1mjvjnn/offered_exemptionpes_f_from_armyshould_i_take_it/,154,0,63,0,2025-08-07T09:33:22Z,Question,"Suffering with anxiety and insomnia and got recommended by mo for pes f ,got told by pcc that the decision lies with me whether to take it or not?Do I take the pes f and leave service or continue serving as a downpes personnel?

Anyone who gotten pes f before do share your experience on life after pes f status from ns thanks

So far that I am aware of the pros and cons are

Pros:

\-2 Years headstart into overseas university,able to work multiple jobs outside without being charged,no longer paid an allowance and able to earn a decent wage,no reservist obligations and no military rules subjected to me anymore.

Cons:No more free healthcare services under 11b,possible discrimination from other Singaporean male due to pes f,insurance related to anxiety and insomnia may be affected?

  
EDIT::thanks for the response guys,I will be taking up the pes F and heading to uni straight.

  
"
36,questions about pes d(irregular heartbeat),Any_Way9345,https://www.reddit.com/r/NationalServiceSG/comments/1mjurxr/questions_about_pes_dirregular_heartbeat/,54,0,22,0,2025-08-07T08:44:24Z,Question,"i received a pes d for irregular heartbeat during the initial cmpb check up. I read that for such cases usually they send for echocardiogram and will consult a Dr afterwards at national heart centre, but in my case they just sent me to raffles hospital for the scan with no one telling me the results after, is this normal for this type of case? to add about my personal physical condition i have always been quite active during my school days but sometimes i feel abit faint even when doing light exercise and one of my parents found to have myocardial bridge condition. should i go about seeing a Dr for this?"
37,NS is gonna make me mentally ill,PuzzleheadedBox9732,https://www.reddit.com/r/NationalServiceSG/comments/1mjts0d/ns_is_gonna_make_me_mentally_ill/,171,0,75,0,2025-08-07T07:40:03Z,Rant,"
In life when you don’t fuck with someone you can just ignore him/walk away/fuck with people you click with.

But here, it doesn’t matter if it’s the worst fucking guy you’ve ever met you still have to sleep, eat, or shit together like y’all are best friends

At the end of the day you can’t go anywhere to let off steam, cause that guy you dislike? He sleeps like 5 metres away from your bed, and it’s like that 24/7 5 days a week

I honestly dk how to deal with this shit for 2 years

"
38,What’s the nicest (or weirdest) thing someone’s said to you in uniform?,BolehBolehBro,https://www.reddit.com/r/NationalServiceSG/comments/1mjtgw0/whats_the_nicest_or_weirdest_thing_someones_said/,66,0,29,0,2025-08-07T07:20:08Z,Discussion,"Something I’ve been wondering lately - when you’re in uniform in public, do you feel acknowledged at all?

In some countries, military or service personnel get thanked, smiled at, even offered seats or a quick word of appreciation. But here in Singapore? Most of the time people just feel… invisible. No nods, no eye contact, nothing. People just glance past you like you’re any other commuter.

Not saying we expect special treatment - but sometimes, especially after a long week in camp, a small gesture like someone offering a seat or even saying “thanks for serving” would honestly mean a lot.

Curious if others feel the same. Have you ever experienced unexpected courtesy while in uniform - or do you just keep your head down and move on?"
39,Possible to stayout as a TO?,Successful-Spam278,https://www.reddit.com/r/NationalServiceSG/comments/1mjnwu8/possible_to_stayout_as_a_to/,85,0,33,0,2025-08-07T02:14:47Z,Question,Waiting to be posted to unit as a TO. Was wondering if I can declare insomnia (which has been coming back recently) and possibly get stayout status. I'm a Pes E TO so I only operate class 3. Do you guys think its possible? 
26,SCS Pro Term CBT Medic Spec,chakn19,https://www.reddit.com/r/NationalServiceSG/comments/1mlan4h/scs_pro_term_cbt_medic_spec/,59,0,19,0,2025-08-08T23:38:45Z,Question,"Just received my pro term posting as a combat medic spec at nee soon camp, just wondering how is life there generally and what are the vetoes for the course? Thanks!!"
27,will having std affect my pes status?,throwawaysbby1807,https://www.reddit.com/r/NationalServiceSG/comments/1ml17ut/will_having_std_affect_my_pes_status/,141,0,48,0,2025-08-08T17:19:16Z,Question,"have quite a few questions, such as if i were to go for discreet check ups, what happen if it turns out to be positive and do i have to declare by going to MO? will it affect my pes status? "
28,Questions about arty pro term scs,jinnisuniverse,https://www.reddit.com/r/NationalServiceSG/comments/1mkvjb4/questions_about_arty_pro_term_scs/,62,0,20,0,2025-08-08T13:41:22Z,Question,Just got my posting today. Is arty pro term shag? What is arty like and how are the days like in Khatib camp?
29,Am I obliged to keep my mobile data on?,GrapefruitOk8621,https://www.reddit.com/r/NationalServiceSG/comments/1mkmse5/am_i_obliged_to_keep_my_mobile_data_on/,161,0,46,0,2025-08-08T05:26:37Z,Discussion,"
Context: I'm in a unit where some of us can be split up to do 1 thing while the rest have to go do another thing. Regulars like to call us to go over and help them, and they usually use WhatsApp. 

Now idt there's an official rule on this. But what if I want to save mobile data and there's no WiFi? Why should the job depend on an NSF having a sufficient data plan? What if I wanna keep my phone on silent? If Regulars not happy they can pay for my data plan. Nothing happened irl, just wanna discuss this hypothetical scenario."
12,Cockpit Screening for RSAF Pilot,cactusjackey,https://www.reddit.com/r/NationalServiceSG/comments/1mlvguq/cockpit_screening_for_rsaf_pilot/,45,0,16,0,2025-08-09T17:44:17Z,Question,Recently did COMPASS and aeromedical tests a few weeks ago. Some of my friends have gotten an invitation for the cockpit screening while I have not. Does this mean I do not have a chance to become a pilot anymore?
13,First mob period confirm activate?,Queasy_Slip_1386,https://www.reddit.com/r/NationalServiceSG/comments/1mltuwf/first_mob_period_confirm_activate/,83,0,38,0,2025-08-09T16:37:17Z,Question,I have mob manning this October and it’s my first ever standby period. Could I check with those that have gone through this before if the first mob manning is confirm activation or is it actually random?
