post_id,title,author,url,num_likes,num_dislikes,num_comments,num_shares,created_utc,flair,post_text
14,I’m just feeling so damn lost as a Soon-To-Be 3SG,OpeningAbalone107,https://www.reddit.com/r/NationalServiceSG/comments/1mltqb8/im_just_feeling_so_damn_lost_as_a_soontobe_3sg/,190,0,101,0,2025-08-09T16:32:02Z,👤 Personal Experience ,"I’m unfit, not confident, and I get anxiety attacks often from over thinking everything.

I have no support structure here in Sg, no friends outside NS, no Family, no home, I rent a fucking dirty run down room here for 500 dollars a month and have to put up with 0 personal space 24/7

I feel like ending it all and just cruling up into a ball, I have no idea how tf I can become a seccom like this when I can’t even get my shit together."
15,ICT (High Key) at Kranji Camp 3. What to expect,blindedredeye,https://www.reddit.com/r/NationalServiceSG/comments/1mloz3e/ict_high_key_at_kranji_camp_3_what_to_expect/,62,0,24,0,2025-08-09T13:05:57Z,Question,"Hi, got an SMS yesterday regarding my first reservist call up (High Key) at Kranji Camp 3 for next year. Was a PES C ASA under HQ CSSCOM, ORDed 3 years ago.

Does anyone know what to expect ? I searched through the subreddit and there wasn't much info. (Please don't tell me about the canteen. I literally ate there everyday during my service).

Thanks !"
16,What to expect from MTI in pro term,Initial-Gas-2925,https://www.reddit.com/r/NationalServiceSG/comments/1mlneec/what_to_expect_from_mti_in_pro_term/,44,0,16,0,2025-08-09T11:42:49Z,Question,jst got posted to MTI. What to expect and is it very shag?
17,OCS Arty Pro Term questions,PreparationMedium423,https://www.reddit.com/r/NationalServiceSG/comments/1mlm1dv/ocs_arty_pro_term_questions/,44,0,16,0,2025-08-09T10:19:07Z,Question,"My batch only has light inf, moto inf and arty for our pro term vocation. I am interested in going arty. How does life in arty training institute and unit look like, and how can i increase my chances of being selected?"
18,"yo chat, are we live?‎ ‎ ‎ ‎ ‎",savoirex,https://www.reddit.com/r/NationalServiceSG/comments/1mlljq1/yo_chat_are_we_live/,4,0,1,0,2025-08-09T09:46:22Z,Question,Ws in da chat
19,Dealing with health issues,MycologistOk8354,https://www.reddit.com/r/NationalServiceSG/comments/1mlky1d/dealing_with_health_issues/,210,0,110,0,2025-08-09T09:04:22Z,Question,"Ok, so I'll be starting ptp very soon but I have a health issue that I'm getting increasingly concerned about and I want to ask some questions regarding it (if anyone has any experience like this or any advice thnk u 🙏)

Ok so I have this thing called Precordial catch syndrome. Basically the symptoms are random bouts of sharp intensive pain at the left side of the chest. This has never really been that big of a trouble for me. But recently, I'd say for the past 3-4 months or so, it has been happening more and more frequently. The durations of these waves of pain vary from like a couple seconds to whole ass 15mins of just constant pain and worrying that my heart is gonna explode. I'm not really sure what caused the frequency of it to increase over the past few months but my theory is that its a mix of me getting back into excercising and also random bouts of panic attacks causing my breathing to increase and hence causing this ?? Regarding all this I have a few questions ... Precordial catch syndrome is said to be harmless but honestly the pain is super unbearable, I have to literally grip my chest and take shallow breaths to try and control it and any movement I make seem to exaggerate the pain. Question is, do I declare this when I go in ?? I'm scared that they will say since its a harmless thing that I should just bare with it and then it happening to me when I'm excercising or anything. TLDR IM JUST REALLY SCARED. I know it's harmless ... but man does it feel good to basically go through a mini heart attack every now and then ...

Any advice tips is appreciated !! Thnks for taking ur time to read this 🙏"
20,Any ideas how to down pes in SCDF ?,mrbrucewaynee21,https://www.reddit.com/r/NationalServiceSG/comments/1mlkc2j/any_ideas_how_to_down_pes_in_scdf/,150,0,68,0,2025-08-09T08:22:14Z,Question,"i want to down pes cuz i damn sian already in station life. now want lepak shake leg . any ideas how guys ?
thinking of want to go to admin or  driver if possible"
21,Thank you to all the duty personnel 🫡,black_knightfc21,https://www.reddit.com/r/NationalServiceSG/comments/1mlfg2j/thank_you_to_all_the_duty_personnel/,10,0,3,0,2025-08-09T03:31:18Z,Discussion,Understand NDP will have alot of people on duty. Thank you so much for doing your part :) 
22,Defaulting on Mandatory NS FIT as a NSman,jkkkkz,https://www.reddit.com/r/NationalServiceSG/comments/1mlfbst/defaulting_on_mandatory_ns_fit_as_a_nsman/,33,0,13,0,2025-08-09T03:25:09Z,Question,"I’m an NSman and I’m in my mandatory NS FIT window (not the voluntary IPT / post-IPPT fail thing). My window is ending soon and I haven’t cleared the requirement (pass IPPT or do 9 NS FIT + 1 IPPT attempt).

It’s my first time defaulting, and I don’t think I can clear it as I have a newborn and it’s hard to find time (not an excuse I know), but what are the consequences for a first timer? Do I need to go down to CMPB or I just need to pay a fine? Any consequences during ICT?"
23,How to wash helmet after IFC,Internal-Hotel876,https://www.reddit.com/r/NationalServiceSG/comments/1mle091/how_to_wash_helmet_after_ifc/,7,0,3,0,2025-08-09T02:18:30Z,Question,"Hi i came from IFC and i don't how to wash helmet, camo is still on my helmet and it smells so bad can anyone tell me how to wah properly can i wash the sponge and metal one or only the cover..?"
24,Going to command sch SCS...,Feisty_Movie_791,https://www.reddit.com/r/NationalServiceSG/comments/1mldzgd/going_to_command_sch_scs/,24,0,8,0,2025-08-09T02:17:24Z,Question,Is going to SCS worth it? After the 6 months do people come out more confident and get public speaking skills and how is life after scs do sergeants get more welfare and is it easier to take leaves/offs.
25,How much of an advantage do I get if I stand at the front of the track during IPPT?,ResearcherWeekly8506,https://www.reddit.com/r/NationalServiceSG/comments/1mlcb3l/how_much_of_an_advantage_do_i_get_if_i_stand_at/,7,0,3,0,2025-08-09T00:56:00Z,Question,"Assuming the timer starts when the last person crosses, I'm wondering how much time would I save being at the front?"
1,Signing on interview tips,AQboopy,https://www.reddit.com/r/NationalServiceSG/comments/1mmj7yf/signing_on_interview_tips/,57,0,26,0,2025-08-10T13:55:57Z,🇸🇬 Regular,"I’m a female and I am set to have an interview with the Navy soon. Just wanted to ask if there’s any advice on aceing the interview/some questions asked.

Also, I heard there will be one with HR and another is panel interview. Is both via MS Teams?"
2,Tips to kilat SCDF uniform,Beginning_Brain8653,https://www.reddit.com/r/NationalServiceSG/comments/1mmj4ks/tips_to_kilat_scdf_uniform/,9,0,3,0,2025-08-10T13:51:59Z,Question,"Going as a ptp batch and my main concern is the ironing . What are some life hacks making ironing easier? 

(Already using starch spray )"
3,IPPT DEFAULTERS PLEASE FALL IN,Acceptable-Squash-93,https://www.reddit.com/r/NationalServiceSG/comments/1mmiuwf/ippt_defaulters_please_fall_in/,81,0,39,0,2025-08-10T13:40:22Z,Question,"Just curious, how many times did you guys defaulted on ippt ? And what were the penalties?

I heard that the max fine is 2,000. Is that true or some bullshit"
4,- Excuse heavy load status -,Ok-Addition-6631,https://www.reddit.com/r/NationalServiceSG/comments/1mmin0a/excuse_heavy_load_status/,44,0,18,0,2025-08-10T13:30:38Z,Question,"Having issues with field pack, went to see MO and got a certain period of excuse heavy load. Missed my SIT test so need to re-sit test. Does my status affect my ability re-sit test? Because I'm not interested in going command school and the re-sit test is going to be on a Friday while everyone books out on Thurs so....

But I'm pretty damn sure my OC is the type who will make you go re-sit test whether you like it or not...

or maybe i just suck thumb cuz 4 more weeks to POP"
5,My OC asked if i would be interested to be his signaller,Most_Edge_8875,https://www.reddit.com/r/NationalServiceSG/comments/1mmh9kl/my_oc_asked_if_i_would_be_interested_to_be_his/,91,0,44,0,2025-08-10T12:27:03Z,Question,"in 1guards rn, currently still bmt-ing. 
during a chill 8km road march i had some 1 on 1 time w my oc, talked to me about becoming his signaller.

from what i can take away in the convo, i'll be sent on a 4 months course at support company if i am ""chosen"", and that i'll basically he his kaki for the rest of unit time. Additionally, it'll be a +10kg in my field pack wherever i go. i'll run his errands in and out of unit, and comms for him whenever needed.

Anyone have any advice on whether it's something i should further push myself to go for? isit just being treated like a bitch, or is there any unique gains i get out of it?"
6,"Pop at tamp hub , alrdy have 4 visitors going. Where else can i watch?",Environmental_Crab82,https://www.reddit.com/r/NationalServiceSG/comments/1mmgg0u/pop_at_tamp_hub_alrdy_have_4_visitors_going_where/,35,0,13,0,2025-08-10T11:44:41Z,Question,"My brother will be having his POP soon . But only 4 people are allowed entry and my 4 other family members are attending. I want to watch too. Is there anywhere else in tampines hub that i can watch the parade? any advice or experience?
"
7,OCS life as a me4t DIS sign on,Imdumb1234567,https://www.reddit.com/r/NationalServiceSG/comments/1mmgb79/ocs_life_as_a_me4t_dis_sign_on/,38,0,14,0,2025-08-10T11:37:32Z,Question,"
Looking for more information on OCS life in dis as a me4t (c4x), particularly about service term. Is the 3 months similar to what you would go through in the other wings? "
8,Do i get to bookout during ptp and brt?,Dazzling-Ad-8775,https://www.reddit.com/r/NationalServiceSG/comments/1mmdlpi/do_i_get_to_bookout_during_ptp_and_brt/,10,0,4,0,2025-08-10T08:52:11Z,Question,I have events that i want to attend during the three month period and its on Saturday. But I'm not sure how the bookout works. Be going in soon in aug
9,Can I bring my Kindle/physical books to Tekong during BMT?,dasspert01,https://www.reddit.com/r/NationalServiceSG/comments/1mmbqq6/can_i_bring_my_kindlephysical_books_to_tekong/,9,0,3,0,2025-08-10T06:51:35Z,Question,"I heard there's a decent amount of admin time during the first two months of PTP, and I love reading anyway"
10,Advice on what to do for my mental state,Specialist_Ad8572,https://www.reddit.com/r/NationalServiceSG/comments/1mmbkzi/advice_on_what_to_do_for_my_mental_state/,130,0,67,0,2025-08-10T06:41:21Z,Question,Hey There! This is a throwaway account I am using and I would like to ask for some advice regarding this ongoing issue of mine that I need help on. More context in the comments because I tried to post the full thing but the bot keeps telling me to post it under the mega thread for some reason.
11,Regret putting yes for command school,Fickle-Poetry3580,https://www.reddit.com/r/NationalServiceSG/comments/1mm6sph/regret_putting_yes_for_command_school/,78,0,38,0,2025-08-10T02:14:09Z,Question,I put yes for command sch and passed my ffi but i regret it now and rather be a man. I have yet to pass any ippt so if i dont pass the last one they wont give me command school posting anymore right.
